,position,company,state,salary,currency,start_sal,end_sal,term
6401,SALES AND MARKETING EXECUTIVE,"""K"" LINE LOGISTICS (M) SDN BHD",Selangor,MYR 3.5K - 4.5K monthly,MYR,3500,4500,monthly
6402,Human Resource Business Partner,HUOBI GLOBAL LIMITED,"Johor, Kuala Lumpur",MYR 8K - 15K monthly,MYR,8000,1000,monthly
6403,IT Software Support,Madsoft Solutions Sdn Bhd,Kuala Lumpur,MYR 3K - 4K monthly,MYR,3000,4000,monthly
6404,Sales Executive,Dongwha Malaysia Sdn Bhd,Nilai,MYR 2.9K - 4.5K monthly,MYR,2900,4500,monthly
6405,"Senior Software Engineer (Full Stack, Node.js)",Snappymob,Kuala Lumpur,MYR 7K - 9K monthly,MYR,7000,9000,monthly
6406,Financial Sales Advisor (Takaful Insurance) - AIA Elite Academy,PN/CKL_HELEN Agency ( a Multi Million Dollar Agency),Penang,MYR 3K - 4.2K monthly,MYR,3000,4200,monthly
6407,Test Manager (Contract 1 year),Prudential BSN Takaful Berhad,Kuala Lumpur,MYR 4.5K - 6.3K monthly,MYR,4500,6300,monthly
6410,Claims Assessor / Specialist (Life Insurance - Major Claims),Company Confidential,"Kuala Lumpur, Selangor, Putrajaya",MYR 4K - 8K monthly,MYR,4000,8000,monthly
6414,"Auxiliary Police, Constable",Perdana ParkCity Sdn Bhd,"Kuala Lumpur, Sabah, Sarawak",MYR 1.2K - 1.3K monthly,MYR,1200,1300,monthly
6417,Order Management Senior Executive - Support China (Contract),Techsap ASP Sdn. Bhd.,"Kuala Lumpur, Selangor",MYR 2.8K - 3.7K monthly,MYR,2800,3700,monthly
6421,Purchasing Assistant Manager,Pecca Leather Sdn Bhd,Selangor,MYR 6.5K - 8K monthly,MYR,6500,8000,monthly
6424,Graphic Designer,Luminance Marketing Sdn.Bhd,Gelugor,MYR 1.4K - 2.1K monthly,MYR,1400,2100,monthly
6426,Internship for finance students,JCL Credit Leasing Sdn Bhd,"Kuala Lumpur, Selangor",MYR 800 - 1K monthly,MYR,800,1000,monthly
6427,Sales and Marketing Executive,Permas Jaya Sdn Bhd,Johor Bahru,MYR 3K - 3.8K monthly,MYR,3000,3800,monthly
6428,Barista (IPC Shopping Centre),Berjaya Starbucks Coffee Company Sdn Bhd,Selangor,MYR 1.3K - 1.5K monthly,MYR,1300,1500,monthly
6431,Product Executive (产品主管人员),Haier Electrical  Appliances (M) Sdn Bhd,Selangor,MYR 3.6K - 5K monthly,MYR,3600,5000,monthly
6437,Event cum Roadshow Ambassador (Johor Bahru),Omniraise Sdn Bhd,Johor,MYR 2.3K - 4.2K monthly,MYR,2300,4200,monthly
6441,Sales Executive,Asia Summit Marketing Sdn Bhd,"Johor, Sabah, Terengganu, Kelantan, Penang, Melaka, Perak",MYR 2.5K - 3.5K monthly,MYR,2500,3500,monthly
6443,After-Sales Administration Assistant (JB),Asia Plantation Capital Berhad,Johor Bahru,MYR 1.6K - 2K monthly,MYR,1600,2000,monthly
6449,Associate Project Manager/ Project Manager,Cognizant Technology Solutions,Selangor,MYR 5K - 8K monthly,MYR,5000,8000,monthly
6451,"Assistant Manager, Operations Support",ELK-DESA Capital Sdn Bhd,Klang/Port Klang,MYR 3.5K - 4.5K monthly,MYR,3500,4500,monthly
6455,SALES AND MARKETING EXECUTIVE / SALES COORDINATOR,LY Steel Pipe Industries Sdn Bhd,Selangor,MYR 2.5K - 3.5K monthly,MYR,2500,3500,monthly
6457,Senior Web Designer,JML CREATIVE RESOURCES,George Town,MYR 4.5K - 6K monthly,MYR,4500,6000,monthly
6461,Relationship/Retention ( Executive/Senior Executive),Agensi Pekerjaan Adecco Personnel Sdn Bhd,Kuala Lumpur,MYR 3K - 4K monthly,MYR,3000,4000,monthly
6463,Civil Engineer,China Railway Engineering Corporation(M) Sdn Bhd,Kuala Lumpur,MYR 5K - 6K monthly,MYR,5000,6000,monthly
6465,Internship for Business Studies/Administration Students,Eastern Decorator Sdn Bhd (Akemi),Perak,MYR 400 - 500 monthly,MYR,400,500,monthly
6466,IT Manager,LYC Mother & Child Centre Sdn. Bhd.,Johor - Others,MYR 5K - 7K monthly,MYR,5000,7000,monthly
6468,Web Designing Specialist,DIGITAL PLANT SDN. BHD.,Petaling Jaya,MYR 3.9K - 4.1K monthly,MYR,3900,4100,monthly
6471,IT Support Executive,ONE XOX SDN BHD,Selangor,MYR 2K - 2.5K monthly,MYR,2000,2500,monthly
6473,Sales Support Admin,COMCORDE MEDICAL (M) SDN BHD,Kuala Lumpur,MYR 1.8K - 2.5K monthly,MYR,1800,2500,monthly
6481,SALES & MARKETING EXECUTIVE,"""K"" LINE LOGISTICS (M) SDN BHD",Bayan Lepas,MYR 3.5K - 4.5K monthly,MYR,3500,4500,monthly
6482,IT Helpdesk Specialist - Mandarin Speaker,Startek,"Kuala Lumpur, Selangor",MYR 2.3K - 4K monthly,MYR,2300,4000,monthly
6485,"Executive, KAA & Service Contact Centre",AmGeneral Insurance Berhad,Kuala Lumpur,MYR 2.4K - 3.6K monthly,MYR,2400,3600,monthly
6486,HR Manager,Company Confidential,Selangor,MYR 4.5K - 6K monthly,MYR,4500,6000,monthly
6489,General Admin,DS ELECTRICAL APPLIANCES & SERVICES SDN BHD,Klang/Port Klang,MYR 1.5K - 2.1K monthly,MYR,1500,2100,monthly
6490,Service Engineer,FUJIFILM (Malaysia) Sdn Bhd,Shah Alam/Subang,MYR 2.6K - 3.5K monthly,MYR,2600,3500,monthly
6493,Accounts Executive (Junior/Senior),Kooka Paper Manufacturing Sdn Bhd,Selangor,MYR 3K - 5K monthly,MYR,3000,5000,monthly
6499,Software Engineer,NEPTRIX SDN. BHD.,Penang,MYR 3K - 4.5K monthly,MYR,3000,4500,monthly
6500,Materials Corrosion Engineer,Intecorr Consultancy,Shah Alam/Subang,MYR 2.5K - 3K monthly,MYR,2500,3000,monthly
6502,QUALITY MANAGEMENT,SRG Asia Pacific Sdn. Bhd.,Kuala Lumpur,MYR 4K - 5.5K monthly,MYR,4000,5500,monthly
6503,"SENIOR EXECUTIVE – MARKETING, COMMUNICATIONS, PR AND FUNDRAISING",MAA MEDICARE CHARITABLE FOUNDATION,Kuala Lumpur,MYR 3.3K - 3.5K monthly,MYR,3300,3500,monthly
6504,Site Supervisor (Architecture),ANCUBIC CAPITAL SDN BHD,Kuala Lumpur,MYR 5K - 6K monthly,MYR,5000,6000,monthly
6506,HR & Accounts Executive,LAMEX WALL,Petaling Jaya,MYR 2.4K - 3.4K monthly,MYR,2400,3400,monthly
6508,Media Sales Executive,Mitcom Sdn Bhd,Petaling Jaya,MYR 2.5K - 5K monthly,MYR,2500,5000,monthly
6509,IT Internship Program,BIOQUEST ADVISORY SDN. BHD.,Kuala Lumpur,MYR 1K - 1K monthly,MYR,1000,1000,monthly
6513,Corporate Communication Specialist ( Beauty Industry),ASK Resources,Kuala Lumpur,MYR 3K - 4.5K monthly,MYR,3000,4500,monthly
6515,Process Engineer,EPS Malaysia,Johor,MYR 7K - 10K monthly,MYR,7000,1000,monthly
6517,Accounts Payable Analyst - Japanese Speaker (Fresh Grad) (AP),Ambition Group Malaysia Sdn Bhd,Kuala Lumpur,MYR 4K - 6K monthly,MYR,4000,6000,monthly
6524,Internship for Computer/IT Students,See Hoy Chan Management Services Sdn. Bhd.,Selangor,MYR 0 - 800 monthly,MYR,0,800,monthly
6528,Maintenance Technician,Company Confidential,Klang/Port Klang,MYR 1.6K - 2.3K monthly,MYR,1600,2300,monthly
6529,Sales Relationship Manager (Immediate Vacancy),Agensi Pekerjaan Manforce Resources (M) Sdn Bhd,Selangor,MYR 5K - 7K monthly,MYR,5000,7000,monthly
6530,Anti-Money Laundering Analyst - Spanish Support,Accenture Technology Solutions Sdn Bhd,Kuala Lumpur,MYR 5K - 7K monthly,MYR,5000,7000,monthly
6531,Mainframe Developer,Tentacle Tech,Kajang/Bangi/Serdang,MYR 5K - 7K monthly,MYR,5000,7000,monthly
6538,Admin Executive (行政人员),ZTE (MALAYSIA) CORPORATION SDN. BHD. 中兴通讯马来西亚,"Kuala Lumpur, Petaling Jaya",MYR 2.5K - 4.5K monthly,MYR,2500,4500,monthly
6539,Collection Officer (SPM/Fresh Graduate Welcome! Up to RM1900)@PJ ref:DL,Capita Global Sdn Bhd,Petaling Jaya,MYR 1.7K - 1.9K monthly,MYR,1700,1900,monthly
6540,QA Executive,IBPO GROUP SDN BHD,Kuala Lumpur,MYR 2K - 3.2K monthly,MYR,2000,3200,monthly
6543,RESTAURANT MANAGEMENT TEAM - ASSISTANT RESTAURANT MANAGER,COSMO RESTAURANTS SDN BHD ( BURGER KING MALAYSIA),"Johor, Kuala Lumpur, Negeri Sembilan, Selangor",MYR 2.1K - 2.3K monthly,MYR,2100,2300,monthly
6548,Planning Executive – Klang,Agensi Pekerjaan AN Asia Sdn Bhd,Klang/Port Klang,MYR 3K - 3.5K monthly,MYR,3000,3500,monthly
6551,Assistant Technical Support Engineer (Contract),FIBERHOME (SINGAPORE) PTE LTD,Kuala Lumpur,MYR 3K - 5K monthly,MYR,3000,5000,monthly
6553,SEO Specialist,U CREATIVE MARKETING SDN. BHD.,Bukit Mertajam,MYR 3K - 5K monthly,MYR,3000,5000,monthly
6560,Senior Finance Executive,Ambition Group Malaysia Sdn Bhd,Shah Alam/Subang,MYR 6K - 8K monthly,MYR,6000,8000,monthly
6561,Corporate Secretary (Penang),AGENSI PEKERJAAN JS STAFFING SERVICES SDN BHD,Penang,MYR 5K - 7K monthly,MYR,5000,7000,monthly
6562,Finance Assistant Manager,JDH Development Sdn Bhd,Petaling Jaya,MYR 3.5K - 5K monthly,MYR,3500,5000,monthly
6563,Concreter,"SINOHYDRO CORPORATION (M) SDN. BHD -  TENOM, SABAH",Sabah - Others,MYR 2.5K - 3.5K monthly,MYR,2500,3500,monthly
6565,Sales Marketing Executive,Kumpulan Saintifik F.E. Sdn Bhd,Selangor,MYR 1.8K - 2.5K monthly,MYR,1800,2500,monthly
6566,PROTEGE Trainee- Clinical Trial Assistant (Oncology Medical Affairs),Novartis Corporation (M) Sdn Bhd,Selangor,MYR 1.5K - 2K monthly,MYR,1500,2000,monthly
6568,Accounts Executive,TIAN AN TRADING SDN BHD,Kuala Lumpur,MYR 4.5K - 5.5K monthly,MYR,4500,5500,monthly
6569,DEPUTY HEAD OF REGULATORY & GOVERNMENT RELATIONS,Persatuan Insurans Am Malaysia (PIAM),Kuala Lumpur,MYR 10K - 14K monthly,MYR,1000,1000,monthly
6570,Truck Driver (Pemandu Lori),BSSB Leather & Fabric Chairs,Selangor,MYR 1.8K - 2.5K monthly,MYR,1800,2500,monthly
6571,CORPORATE SALES CONSULTANT,SRG Asia Pacific Sdn. Bhd.,Kuala Lumpur,MYR 2.6K - 3.5K monthly,MYR,2600,3500,monthly
6575,"Quatity Surveyor (QS) -- Masai, Johor",Nala Employment Malaysia,Johor,MYR 3K - 4K monthly,MYR,3000,4000,monthly
6576,"Executive,Corporate Secretarial",Agensi Pekerjaan Chrisjac Sdn Bhd,Kuala Lumpur,MYR 3K - 4K monthly,MYR,3000,4000,monthly
6577,Development Engineer,KELLYOCG MALAYSIA SDN BHD,Kuala Lumpur,MYR 5K - 6.5K monthly,MYR,5000,6500,monthly
6579,Maintenance Technician (Contract),Mattel Development and Tooling Sdn Bhd,Perai,MYR 1.5K - 2.1K monthly,MYR,1500,2100,monthly
6581,PROTEGE Trainee- Clinical Trial Assistant (Trial Monitoring),Novartis Corporation (M) Sdn Bhd,Selangor,MYR 1.5K - 2K monthly,MYR,1500,2000,monthly
6583,Sales Executive,SANCORA PAINTS INDUSTRIES SDN BHD,Johor,MYR 2K - 3K monthly,MYR,2000,3000,monthly
6584,Sales Executive,PruAction Team (M) Sdn Bhd,Petaling Jaya,MYR 3K - 5K monthly,MYR,3000,5000,monthly
6587,Junior Draughtperson,Metalglaz Technology (M) Sdn Bhd,Puchong,MYR 2K - 3K monthly,MYR,2000,3000,monthly
6588,Sales Executive,NCS SCIENCE SDN BHD,Puchong,MYR 3K - 4K monthly,MYR,3000,4000,monthly
6589,"Partnership Manager, General Insurance",AIA Bhd.,Kuala Lumpur,MYR 8K - 11K monthly,MYR,8000,1000,monthly
6592,Engineer & CePSWaM – Shah Alam,Agensi Pekerjaan AN Asia Sdn Bhd,Shah Alam/Subang,MYR 2.5K - 3.5K monthly,MYR,2500,3500,monthly
6593,Accounts Executive,S L NG Group of Companies,Subang Jaya,MYR 3K - 3.5K monthly,MYR,3000,3500,monthly
6594,Production Supervisor,Agensi Pekerjaan CareerMaster Sdn Bhd,Johor,MYR 3K - 5K monthly,MYR,3000,5000,monthly
6600,Account Payable Executive – Shah Alam,Agensi Pekerjaan AN Asia Sdn Bhd,Shah Alam/Subang,MYR 2.8K - 3.2K monthly,MYR,2800,3200,monthly
6601,Finance Executive,Company Confidential,Penang,MYR 3K - 4.5K monthly,MYR,3000,4500,monthly
6602,"Supervisor, Finance (Diploma)",Top Glove Corporation Berhad,Selangor,MYR 1.5K - 2.5K monthly,MYR,1500,2500,monthly
6603,ACCOUNT EXECUTIVE,OLT BEVERAGES SDN BHD,Johor Bahru,MYR 3K - 3.5K monthly,MYR,3000,3500,monthly
6604,Manager Retail Assets Management (Re: IRWG),Idealseed Resources Sdn Bhd,Selangor,MYR 7K - 12K monthly,MYR,7000,1000,monthly
6605,SERVICE ADVISOR,JARRI ENGINEERING SDN BHD,Sabah,MYR 1.2K - 1.7K monthly,MYR,1200,1700,monthly
6606,Beauty Salon Manager (Earn up to RM6K),RUYI BEAUTE,Rawang,MYR 6K - 6.5K monthly,MYR,6000,6500,monthly
6613,Head of Golf & Recreations,Glenmarie Golf & Country Club,Shah Alam/Subang,MYR 7K - 8K monthly,MYR,7000,8000,monthly
6615,Online Customer Service,FIERAMY RESOURCES,Bentong,MYR 1.1K - 1.2K monthly,MYR,1100,1200,monthly
6617,"HR Business Partner - Based in China, manufacturing, HRIS (ref: SH)",Capita Global Sdn Bhd,"Johor, Kuala Lumpur, Penang, Selangor, Putrajaya",MYR 12K - 14K monthly,MYR,1000,1000,monthly
6619,Graphic Designer,Ideallex Sdn Bhd,Johor Bahru,MYR 1.8K - 2K monthly,MYR,1800,2000,monthly
6620,Account Cum Admin Executive,LNS Integration Sdn Bhd,Kuala Lumpur,MYR 3.5K - 4K monthly,MYR,3500,4000,monthly
6623,Sales and Marketing Representative (Penang) 品牌销售员,HATCH HOME CONCEPT SDN BHD,George Town,MYR 2.3K - 3.5K monthly,MYR,2300,3500,monthly
6624,"Internship for Banking and Financial Students (JB, KL and PG)",JONE MOWIC SDN BHD,"Johor, Kuala Lumpur, Penang, Selangor",MYR 500 - 1K monthly,MYR,500,1000,monthly
6625,Financial Marketing  cum Marketing Executive    (offline cum online ),WEALTH MANAGEMENT PARTNERS,"Johor, Kedah, Kuala Lumpur, Melaka, Negeri Sembilan, Penang, Perak, Selangor",MYR 3K - 6K monthly,MYR,3000,6000,monthly
6627,"Full Stack Web Developer - Up to RM7,000 per month",Plentisoft Sdn Bhd,Selangor,MYR 6K - 8.4K monthly,MYR,6000,8400,monthly
6629,DRIVER,RAHAR VISTA SDN BHD,Klang/Port Klang,MYR 1.8K - 2.7K monthly,MYR,1800,2700,monthly
6630,Project Supervisor (M&E),ANCUBIC CAPITAL SDN BHD,Kuala Lumpur,MYR 5K - 6K monthly,MYR,5000,6000,monthly
6635,Audit Manager,YYC & Co,Kuala Lumpur,MYR 7K - 8.5K monthly,MYR,7000,8500,monthly
6638,Marketing Automation Specialist,TDCX,Kuala Lumpur,MYR 9K - 12K monthly,MYR,9000,1000,monthly
6639,"Mobile App Developer (iOS, Android)",S-Cube Sdn Bhd,Petaling Jaya,MYR 3.5K - 7K monthly,MYR,3500,7000,monthly
6642,Junior Conveyancing Lawyer,Vincy Wong & Co,Kuala Lumpur,MYR 2.8K - 4K monthly,MYR,2800,4000,monthly
6645,FINANCIAL CONSULTANT EXECUTIVE ( KL BRANCH),JCL Credit Leasing Sdn Bhd,"Kuala Lumpur, Selangor",MYR 2K - 3K monthly,MYR,2000,3000,monthly
6650,Internship,Baloy Sdn. Bhd.,Shah Alam/Subang,MYR 800 - 1K monthly,MYR,800,1000,monthly
6656,Sales Executive,Beaufix Enterprises Sdn Bhd,Petaling Jaya,MYR 2.5K - 4K monthly,MYR,2500,4000,monthly
6657,Quantity Surveyor,China Construction Engineering (S.E.A) Malaysia Sdn. Bhd.,"Johor - Others, Kuala Lumpur, Bentong",MYR 3.3K - 4.5K monthly,MYR,3300,4500,monthly
6662,Marketing Manager (Digital Marketing / SEO),U CREATIVE MARKETING SDN. BHD.,Bukit Mertajam,MYR 4K - 6K monthly,MYR,4000,6000,monthly
6665,Thermal power plant operation specialist,JINGXING HOLDINGS (M) SDN. BHD.,Selangor,MYR 8K - 10K monthly,MYR,8000,1000,monthly
6666,Corporate Secretary (MAICSA / MACS / LS),Goodwill Management Services Sdn Bhd,Johor Bahru,MYR 2.6K - 3.8K monthly,MYR,2600,3800,monthly
6668,Human Resource Executive,Sanjung Khas Sdn Bhd,Shah Alam/Subang,MYR 3K - 6K monthly,MYR,3000,6000,monthly
6669,Medical Device Sales Representative-Central,KELLYOCG MALAYSIA SDN BHD,"Kuala Lumpur, Selangor",MYR 4K - 7K monthly,MYR,4000,7000,monthly
6672,Business Development Executive-Microbulk,Air Products Malaysia Sdn Bhd,Shah Alam/Subang,MYR 3K - 3.5K monthly,MYR,3000,3500,monthly
6677,Customer Service Cum Planner,TRIOTAC INDUSTRY SDN BHD,Johor Bahru,MYR 3.2K - 4K monthly,MYR,3200,4000,monthly
6679,Audit Assistant/Semi-Senior,"Roger Yue, Tan & Associates",Selangor,MYR 2.6K - 5K monthly,MYR,2600,5000,monthly
6681,Marketing Manager,IDS Medical Systems (M) Sdn Bhd,Selangor,MYR 9K - 12K monthly,MYR,9000,1000,monthly
6682,HR Manager (48686) [KT],Agensi Pekerjaan Reeracoen Malaysia Sdn Bhd,"Negeri Sembilan, Selangor",MYR 9K - 15K monthly,MYR,9000,1000,monthly
6684,Account Executive and Client Servicing,Clover Creative & Communications Sdn Bhd,Kuala Lumpur,MYR 2.8K - 3.5K monthly,MYR,2800,3500,monthly
6685,Executive - Case Monitoring (English and Native Japanese Language Support),Scicom (MSC) Berhad,Kuala Lumpur,MYR 6K - 7K monthly,MYR,6000,7000,monthly
6686,MEDICAL REPRESENTATIVE,Glenmark Pharmaceuticals (M) Sdn Bhd,Kuala Lumpur,MYR 2K - 4K monthly,MYR,2000,4000,monthly
6687,Process Engineer,Allied Precision Technologies (M) Sdn Bhd,Melaka,MYR 2.5K - 3.5K monthly,MYR,2500,3500,monthly
6696,"Business Development Executive - Bukit Rambai, Melaka - Salary >RM5000",Kelly Contingent Workforce Recruitment Johor Bahru,Melaka,MYR 5K - 7K monthly,MYR,5000,7000,monthly
6700,Technician CCTV Surveillance System,RS Techwin Sdn Bhd,Kuala Lumpur,MYR 1.8K - 3K monthly,MYR,1800,3000,monthly
6703,Online Digital Marketing Executive,MACTION SDN. BHD.,Bukit Mertajam,MYR 2.5K - 4K monthly,MYR,2500,4000,monthly
6707,ASSISTANT SUPERVIOR,AZ GROWTH MANAGEMENT,Kedah,MYR 1.2K - 1.5K monthly,MYR,1200,1500,monthly
6708,Digital Marketing/ SEO Intern (RM1000 Allowance) - Jan 2021 Intake,SearchGuru Sdn Bhd,Kuala Lumpur,MYR 800 - 1K monthly,MYR,800,1000,monthly
6710,Sales Manager,Southern Crescent Sdn Bhd,Kuala Lumpur,MYR 3.8K - 4K monthly,MYR,3800,4000,monthly
6712,Executive-Technical Support Premium Care (English and NATIVE Japanese),Scicom (MSC) Berhad,Kuala Lumpur,MYR 8K - 9.5K monthly,MYR,8000,9500,monthly
6713,"Mortgage Consultant, Bancaassurance",UPG Wealth Advisory,Selangor,MYR 4.5K - 9K monthly,MYR,4500,9000,monthly
6716,"Sales & Marketing Executive (Basic RM 2000 + Commission up to RM 20,000)",Agensi Pekerjaan BGC Group (Malaysia) Sdn Bhd,Kuala Lumpur,MYR 10K - 15K monthly,MYR,1000,1000,monthly
6718,Quantity Surveyor,Dumas Holdings Sdn Bhd,Kuching,MYR 2.8K - 3.5K monthly,MYR,2800,3500,monthly
6719,Sales and Customer Success Specialist,VIN ASIA SDN. BHD.,Cyberjaya,MYR 4K - 6K monthly,MYR,4000,6000,monthly
6720,Human Resource Manager,NNR Global Logistics (M) Sdn Bhd,Selangor,MYR 6K - 8.4K monthly,MYR,6000,8400,monthly
6725,Pest Control Technician - Singapore,JobPlus Pte Ltd,Central,MYR 4K - 4.5K monthly,MYR,4000,4500,monthly
6727,Business Development Executive,Public Gold Marketing Sdn Bhd,"Johor Bahru, Alor Setar, Sungai Petani, Melaka, Bayan Lepas, Ipoh, Kota Kinabalu, Ampang, Kajang/Bangi/Serdang, Kuching",MYR 2.5K - 4.5K monthly,MYR,2500,4500,monthly
6732,Admin & Accounting Support [Ref: 49008] (CM),Agensi Pekerjaan Reeracoen Malaysia Sdn Bhd,Selangor,MYR 2.8K - 3K monthly,MYR,2800,3000,monthly
6733,Graphic Designer,De Deux Cosmetics Sdn Bhd,Kuala Lumpur,MYR 2.8K - 3.2K monthly,MYR,2800,3200,monthly
6734,PS Account Delivery Specialist,Lenovo,"Penang, Selangor",MYR 83K - 140K monthly,MYR,8000,1000,monthly
6735,Manager - Production,C-Food Portions Sdn Bhd,Ampang,MYR 6K - 6.5K monthly,MYR,6000,6500,monthly
6737,Frontend Web Developer - KL,Agensi Pekerjaan AN Asia Sdn Bhd,Kuala Lumpur,MYR 6K - 9K monthly,MYR,6000,9000,monthly
6738,Mobile Application Developer,Rocketsview Management Sdn Bhd,Kuala Lumpur,MYR 4K - 6K monthly,MYR,4000,6000,monthly
6740,Sales cum Accounting Assistant,CHL INNOVATION INDUSTRIES SDN BHD,Bukit Mertajam,MYR 1.5K - 3K monthly,MYR,1500,3000,monthly
6743,HR Executive,J&T Express (Malaysia) Sdn Bhd - Northern Selangor,Cheras,MYR 2.2K - 3.2K monthly,MYR,2200,3200,monthly
6746,HR Manager,Doo Technology MY Sdn. Bhd,Kuala Lumpur,MYR 8K - 12K monthly,MYR,8000,1000,monthly
6747,Ocean Export Coordinator,Quanterm Logistics Sdn Bhd,Shah Alam/Subang,MYR 2K - 2.5K monthly,MYR,2000,2500,monthly
6748,Contract Validation Executive,Global Enterprise International Malaysia Sdn Bhd (Member of Singtel Group),Selangor,MYR 3.2K - 4.2K monthly,MYR,3200,4200,monthly
6749,Assistant Manager,Fast Track Sdn Bhd,Gelugor,MYR 300 - 500 monthly,MYR,300,500,monthly
6750,IT SYSTEM DEVELOPER,Zetro Services Sdn Bhd,Nilai,MYR 3K - 4.2K monthly,MYR,3000,4200,monthly
6751,Senior GL Accountant / Team Lead (Regional Support),TMF Group,Kuala Lumpur,MYR 4.2K - 5.9K monthly,MYR,4200,5900,monthly
6752,Plant Engineer (Project &Packaging),Agensi Pekerjaan Adecco Personnel Sdn Bhd,Johor,MYR 7.2K - 8.4K monthly,MYR,7200,8400,monthly
6754,ACCOUNTS OFFICER,JFA JAYA SDN BHD,Bukit Mertajam,MYR 1.5K - 2.1K monthly,MYR,1500,2100,monthly
6755,Digital Marketing Executive,ASICS MALAYSIA SDN. BHD.,Kuala Lumpur,MYR 3.8K - 5.4K monthly,MYR,3800,5400,monthly
6756,IT Contract Adminstrator / Specialist,Company Confidential,Cyberjaya,MYR 5K - 6.5K monthly,MYR,5000,6500,monthly
6757,R & D ( Plant Based Food Protein Vegan ),SAN YANG ENTERPRISE SDN BHD,Klang/Port Klang,MYR 2K - 2.8K monthly,MYR,2000,2800,monthly
6759,Interior Designer,ESP DESIGN SDN. BHD.,Selangor,MYR 4K - 5K monthly,MYR,4000,5000,monthly
6760,Production Line Leader,VISCO TECHNOLOGY Sdn Bhd,Perai,MYR 1.7K - 2K monthly,MYR,1700,2000,monthly
6761,Technical Sales Executive(Penang),Agensi Pekerjaan Career Medi (M) Sdn Bhd,"Kulim, Kuala Lumpur, Bayan Lepas",MYR 2.8K - 3K monthly,MYR,2800,3000,monthly
6764,IT Engineer Software/ Programmer,XSD International Paper,Kulim,MYR 2.5K - 5K monthly,MYR,2500,5000,monthly
6765,Accounts Assistant,MOEM Holdings Sdn Bhd,Klang/Port Klang,MYR 1.5K - 1.8K monthly,MYR,1500,1800,monthly
6766,HR CUM ADMIN EXECUTIVE,Fly Software Sdn Bhd,Johor,MYR 3.5K - 5K monthly,MYR,3500,5000,monthly
6769,"Mould Fabricator/Filter – Based in Beranang, Kajang",Hume Concrete Sdn Bhd,Semenyih,MYR 2K - 4K monthly,MYR,2000,4000,monthly
6777,Multimedia Design Intern,Camps & Apparels Corporation Sdn Bhd,Kuala Lumpur,MYR 300 - 500 monthly,MYR,300,500,monthly
6780,Sales & Marketing Manager,XEGO EMPIRE SDN BHD,Kemaman,MYR 2K - 2.8K monthly,MYR,2000,2800,monthly
6781,LAWYER,Armiy Rais Advocates & Solicitors,Kuala Lumpur,MYR 5K - 10K monthly,MYR,5000,1000,monthly
6783,Senior Software Developer - Java,Hytech Consulting Management Sdn Bhd,Kuala Lumpur,MYR 6.5K - 8K monthly,MYR,6500,8000,monthly
6787,R&D Executive,SAN MIGUEL YAMAMURA WOVEN PRODUCTS SDN. BHD.,Melaka,MYR 2.8K - 3.3K monthly,MYR,2800,3300,monthly
6790,Freight Operations Executive (Freight forwarding job),Agensi Pekerjaan Chrisjac Sdn Bhd,Petaling Jaya,MYR 2.5K - 3.5K monthly,MYR,2500,3500,monthly
6791,Software Developer – Embedded Automotive,EDAG Holding Sdn Bhd,Shah Alam/Subang,MYR 3K - 4.5K monthly,MYR,3000,4500,monthly
6793,SOUS CHEF LOCAL TRADITIONAL,PICCOLO MONDO GASTRO SDN BHD,Kuala Lumpur,MYR 3.5K - 4K monthly,MYR,3500,4000,monthly
6795,Business Development Manager,BRIGHT PROPERTY SERVICE (MALAYSIA) SDN. BHD.,"Johor, Selangor, Kuala Lumpur",MYR 6K - 9K monthly,MYR,6000,9000,monthly
6796,Application & Service Engineer,Agensi Pekerjaan CareerMaster Sdn Bhd,Penang,MYR 3.2K - 3.5K monthly,MYR,3200,3500,monthly
6797,Staff Engineer Maintenance Pre Assembly,Infineon Technologies Advance Logic Sdn Bhd,Melaka,MYR 4.9K - 9K monthly,MYR,4900,9000,monthly
6798,Network Engineer,PREELION TECHNOLOGIES SDN. BHD.,Johor Bahru,MYR 3.5K - 4.3K monthly,MYR,3500,4300,monthly
6799,Senior/Mechanical Design Engineer,Salutica Allied Solutions Sdn. Bhd.,Ipoh,MYR 2.8K - 5.5K monthly,MYR,2800,5500,monthly
6802,Senior Software Engineer,Acodes Tech Sdn Bhd,Kuala Lumpur,MYR 8K - 10K monthly,MYR,8000,1000,monthly
6803,"Manager, Enterprise Risk Management",Ambition Group Malaysia Sdn Bhd,Kuala Lumpur,MYR 120K - 120K monthly,MYR,1000,1000,monthly
6805,Test Development Engineer,Salutica Allied Solutions Sdn. Bhd.,Ipoh,MYR 2.8K - 5K monthly,MYR,2800,5000,monthly
6809,Key Account Executive (Kelantan),NINJA LOGISTICS SDN. BHD.,Kelantan,MYR 2K - 2.8K monthly,MYR,2000,2800,monthly
6810,Unity Game Programmer,Instamedia Premium Solution Sdn Bhd,Kuala Lumpur,MYR 600 - 800 monthly,MYR,600,800,monthly
6811,Accounts Assistant (Credit Control),M-Security Technology Sdn Bhd,Johor Bahru,MYR 2.5K - 3.5K monthly,MYR,2500,3500,monthly
6812,SITE SUPERVISOR (CONTRACT),ULIK CONSTRUCTION SDN. BHD,Selangor,MYR 5.8K - 8K monthly,MYR,5800,8000,monthly
6814,Learning and Development Specialist,Agensi Pekerjaan Hays (Malaysia) Sdn Bhd,Kuala Lumpur,MYR 7K - 9K monthly,MYR,7000,9000,monthly
6815,ADMIN EXECUTIVE,BINTANG EMAS UTAMA SDN. BHD.,Kuching,MYR 2.5K - 3.5K monthly,MYR,2500,3500,monthly
6820,Commercial Officer,Tan Lan Holdings (M) Sdn Bhd,Perak,MYR 1.6K - 2.4K monthly,MYR,1600,2400,monthly
6821,Buyer,Company Confidential,Kuala Lumpur,MYR 3K - 4.2K monthly,MYR,3000,4200,monthly
6823,Material Planner cum Buyer,Company Confidential,Kulim,MYR 3K - 4.2K monthly,MYR,3000,4200,monthly
6824,Web Graphic Designer Executive,LU FU MAO MALAYSIA SDN BHD,Cyberjaya,MYR 3K - 3.5K monthly,MYR,3000,3500,monthly
6825,Automation Sales Manager (Robots for Automotive),Agensi Pekerjaan GMP (M)  Sdn Bhd,"Kuala Lumpur, Selangor, Putrajaya",MYR 9K - 12K monthly,MYR,9000,1000,monthly
6827,Sales Executive (Attractive Salary + HIGH COMMISSION (UP TO 5 FIGURE),JT APPS SDN. BHD.,Kuala Lumpur,MYR 3.1K - 6K monthly,MYR,3100,6000,monthly
6828,Graphic Designer,FREAKOUT MALAYSIA SDN. BHD.,Kuala Lumpur,MYR 2.5K - 3K monthly,MYR,2500,3000,monthly
6829,Fullstack Java Consultant,dJAVA Factory Sdn Bhd,Kuala Lumpur,MYR 5K - 10K monthly,MYR,5000,1000,monthly
6834,Research and Development,Fast Track Sdn Bhd,Gelugor,MYR 300 - 500 monthly,MYR,300,500,monthly
6838,Quotation Engineer,Straits Orthopaedics (Mfg) Sdn Bhd,Penang,MYR 3K - 4.5K monthly,MYR,3000,4500,monthly
6841,Sales Executive,Eco Solidwaste Park Sdn Bhd,Rawang,MYR 2.5K - 3.3K monthly,MYR,2500,3300,monthly
6842,PROPRIETARY TRADER,JOSHUA TREE SDN BHD,Penang,MYR 1.3K - 2K monthly,MYR,1300,2000,monthly
6843,JKR FACILITIES MANAGER (Melaka),Digistar Holdings Sdn Bhd,"Johor, Kedah, Kuala Lumpur, Kelantan, Melaka, Negeri Sembilan, Penang, Pahang, Perak, Perlis, Selangor, Terengganu, Labuan, Putrajaya",MYR 4K - 6.5K monthly,MYR,4000,6500,monthly
6846,PHP Software Developer,Acodes Tech Sdn Bhd,Kuala Lumpur,MYR 3.5K - 6K monthly,MYR,3500,6000,monthly
6849,Real Estate cum Property Specialist (Earn from MYR10K-MYR20K),Jed Ong (FLP REALTY),"Kuala Lumpur, Selangor",MYR 10K - 20K monthly,MYR,1000,2000,monthly
6850,Mobile App Developer (iOS),Tentacle Tech,Kuala Lumpur,MYR 5K - 7.5K monthly,MYR,5000,7500,monthly
6854,Quality Assurance Engineer,Xendity Sdn Bhd,Kuala Lumpur,MYR 3.5K - 7K monthly,MYR,3500,7000,monthly
6855,"Engineer, Infrastructure (Server)",Macro Kiosk Berhad,Kuala Lumpur,MYR 3K - 4.2K monthly,MYR,3000,4200,monthly
6856,"Executive/Senior Executive, Finance & Accounts",Glenmarie Golf & Country Club,Shah Alam/Subang,MYR 2.5K - 5K monthly,MYR,2500,5000,monthly
6857,Unit Trust Consultant,PUBLIC MUTUAL BERHAD,"Johor, Kedah, Kuala Lumpur, Melaka, Negeri Sembilan, Penang, Pahang, Perak, Selangor, Putrajaya",MYR 8K - 10K monthly,MYR,8000,1000,monthly
6859,Conveyancing Clerk,Hariati & Khoo,Kuala Lumpur,MYR 2.4K - 3.4K monthly,MYR,2400,3400,monthly
