,position,company,state,salary,currency,start_sal,end_sal,term
3961,Translator - Mandarin to English (Home based),Linguo Go Enterprise,"Johor, Kedah, Kuala Lumpur, Kelantan, Melaka, Negeri Sembilan, Penang, Sabah, Selangor, Sarawak",MYR 4.9K - 6.9K monthly,MYR,4900,6900,monthly
3963,Business Development/ Marketing Intern,BookDoc,Petaling Jaya,MYR 300 - 500 monthly,MYR,300,500,monthly
3968,Technician Electronic (Puchong),JESS Technology Sdn Bhd,"Kuala Lumpur, Selangor",MYR 1.4K - 2K monthly,MYR,1400,2000,monthly
3971,Sustainability Analyst,Synergio Global Sdn Bhd,Kuala Lumpur,MYR 3K - 4.2K monthly,MYR,3000,4200,monthly
3983,遊戲測試工程師,MATRIX TALENT HUMAN RESOURCES SDN. BHD.,Japan,MYR 15K - 23K monthly,MYR,1000,2000,monthly
3984,Account Clerk,S T Auto (KL) Sdn Bhd,Kuala Lumpur,MYR 2K - 3K monthly,MYR,2000,3000,monthly
3985,Genomics Business Associate,ScienceVision Sdn Bhd,"Kuala Lumpur, Selangor",MYR 2.6K - 4.5K monthly,MYR,2600,4500,monthly
3998,Graduate Trainee (Degree),Infineon Technologies (Kulim) Sdn Bhd,Kulim,MYR 2K - 2.8K monthly,MYR,2000,2800,monthly
3999,Sales Specialist (Attractive Commission Scheme!!) @ Leading Bank,timesconsult,"Johor, Kedah, Kuala Lumpur, Kelantan, Melaka, Negeri Sembilan, Penang, Pahang, Perak, Perlis, Sabah, Selangor, Sarawak, Terengganu, Labuan, Putrajaya",MYR 2K - 4K monthly,MYR,2000,4000,monthly
4002,Digital Marketing Manager,Company Confidential,Kuala Lumpur,MYR 2.5K - 5K monthly,MYR,2500,5000,monthly
4004,Sales and Admin Executive,Pembinaan Sima Sdn Bhd,Petaling Jaya,MYR 2.8K - 3.9K monthly,MYR,2800,3900,monthly
4008,Business Development Executive,PALAQUIN (M) SDN BHD,Ipoh,MYR 1.8K - 2K monthly,MYR,1800,2000,monthly
4009,Finance cum Admin Senior Executive,MAXALL SDN. BHD.,Petaling Jaya,MYR 3.8K - 5.4K monthly,MYR,3800,5400,monthly
4010,Customer Service,Tsubaki Power Transmission (Malaysia) Sdn Bhd,Shah Alam/Subang,MYR 1.2K - 1.5K monthly,MYR,1200,1500,monthly
4011,"Head, Data Analyst",WOWSHOP SDN BHD,Kuala Lumpur,MYR 7.5K - 11K monthly,MYR,7500,1000,monthly
4012,Senior Mobile Developer (iOS / Android),Ezurazz Group Sdn Bhd,Kuala Lumpur,MYR 3.5K - 5K monthly,MYR,3500,5000,monthly
4016,ONLINE SALES ADMIN,ADDAR GLOBAL SDN BHD,Kuala Lumpur,MYR 1.2K - 2.4K monthly,MYR,1200,2400,monthly
4018,Senior Software Engineer/Developer (Python),Agensi Pekerjaan Execsearch Sdn Bhd,Cyberjaya,MYR 7K - 9.5K monthly,MYR,7000,9500,monthly
4021,Business Development Executive - UK & EU Market,Capita Global Sdn Bhd,"Kuala Lumpur, Selangor",MYR 2.5K - 3.2K monthly,MYR,2500,3200,monthly
4022,"Teachers (Bahasa Melayu, English, Mandarin, Biology)",Sequoia International School,Kajang/Bangi/Serdang,MYR 3K - 5K monthly,MYR,3000,5000,monthly
4026,FRESH GRADUATE - Customer Service Specialist- Up to RM 3500 (Bangsar),Kelly Services (Malaysia) Sdn Bhd,Kuala Lumpur,MYR 2.6K - 4K monthly,MYR,2600,4000,monthly
4032,Wealth Management Associate Programme (Sales) - Klang Valley,RHB Banking Group,"Kuala Lumpur, Selangor",MYR 2.8K - 3.6K monthly,MYR,2800,3600,monthly
4033,Webmaster,Cheil Malaysia Sdn Bhd,Kuala Lumpur,MYR 3K - 6K monthly,MYR,3000,6000,monthly
4035,Wealth Management Associate Programme (Sales) - Southern Region,RHB Banking Group,Johor,MYR 2.8K - 3K monthly,MYR,2800,3000,monthly
4038,Management Executive,Thong Thye Siang Sdn Bhd,Selangor,MYR 2.5K - 3.8K monthly,MYR,2500,3800,monthly
4039,Marketing Assistant,PUREWAX COMPANY,Butterworth,MYR 2.3K - 2.7K monthly,MYR,2300,2700,monthly
4048,Group Accountant - MIA (RM14K - RM18K @ Public Listed Company),AGENSI PEKERJAAN DREAM CAREER SDN BHD,"Kuala Lumpur, Selangor",MYR 14K - 18K monthly,MYR,1000,1000,monthly
4049,Fullstack Engineer,Ambition Group Malaysia Sdn Bhd,Kuala Lumpur,MYR 7K - 13K monthly,MYR,7000,1000,monthly
4050,Senior Software Developer (JAVA),Berjaya Sompo Insurance Berhad,Kuala Lumpur,MYR 5K - 8.8K monthly,MYR,5000,8800,monthly
4051,"Personal Banker Banca (Insurance Advisor) - Jinjang, Selayang, Sg Buloh",RHB Banking Group,Kuala Lumpur,MYR 2.2K - 4K monthly,MYR,2200,4000,monthly
4053,Customer Service Specialist,Funnel Duo Media Sdn Bhd,Petaling Jaya,MYR 3K - 4.5K monthly,MYR,3000,4500,monthly
4057,purchasing assistant/admin(manufacturing/Sungai Buloh),ASK Resources,"Kuala Lumpur, Selangor",MYR 2K - 2.8K monthly,MYR,2000,2800,monthly
4060,Software Engineer,TOP HUNT SDN BHD,Kuala Lumpur,MYR 3.5K - 4.9K monthly,MYR,3500,4900,monthly
4061,Assistant Account Manager (Public Listed Company  @ Semenyih),AGENSI PEKERJAAN DREAM CAREER SDN BHD,"Kuala Lumpur, Selangor",MYR 6K - 8K monthly,MYR,6000,8000,monthly
4064,Warehouse Manager,PUSTAKA JASA SDN. BHD.,Kajang/Bangi/Serdang,MYR 3K - 6K monthly,MYR,3000,6000,monthly
4066,Site Engineer for Aluminium and Glass,Titan Vista Sdn Bhd,Selangor,MYR 2.8K - 3.5K monthly,MYR,2800,3500,monthly
4067,UI UX Designer,Excard Corporation Sdn Bhd,"Sungai Petani, Penang",MYR 4K - 5.3K monthly,MYR,4000,5300,monthly
4074,IBS PRODUCTION SUPERVISOR,Corporate Builders Sdn Bhd,Penang,MYR 2K - 2.8K monthly,MYR,2000,2800,monthly
4076,Account Executive (Accounting),Perfect Rooms Sdn. Bhd.,Kuching,MYR 5K - 7K monthly,MYR,5000,7000,monthly
4078,PROJECT MANAGER (Construction),Company Confidential,Port Dickson,MYR 8K - 11K monthly,MYR,8000,1000,monthly
4080,Assistant Restaurant General Manager (Desa Sri Hartamas),Company Confidential,Kuala Lumpur,MYR 3K - 3.5K monthly,MYR,3000,3500,monthly
4082,Account Executives,Pembinaan Sima Sdn Bhd,Petaling Jaya,MYR 2.8K - 3.9K monthly,MYR,2800,3900,monthly
4084,Videographer,Capita Global Sdn Bhd,"Kuala Lumpur, Selangor",MYR 2.1K - 2.3K monthly,MYR,2100,2300,monthly
4086,Senior Java Developer,UPSTREAM VENTURES (M) SDN. BHD.,Kuala Lumpur,MYR 7.5K - 11K monthly,MYR,7500,1000,monthly
4087,"INTERNSHIP, MARKETING",AmBank (M) Berhad,Kuala Lumpur,MYR 900 - 1K monthly,MYR,900,1000,monthly
4090,"Senior Quality Engineer (Plexus,Penang Design Center)",Plexus Manufacturing Sdn Bhd,Penang,MYR 6K - 8K monthly,MYR,6000,8000,monthly
4091,Sales Manager,Company Confidential,Petaling Jaya,MYR 2K - 3.5K monthly,MYR,2000,3500,monthly
4093,EKSEKUTIF SUMBER MANUSIA,SSR / SSSB / TCR,Kuala Lumpur,MYR 1.5K - 1.8K monthly,MYR,1500,1800,monthly
4095,Technician - Machine Software Application  (Puchong),JESS Technology Sdn Bhd,"Kuala Lumpur, Selangor",MYR 1.4K - 2K monthly,MYR,1400,2000,monthly
4124,Spatial Designer,Sportopia Limited,Kuala Lumpur,MYR 4K - 7.5K monthly,MYR,4000,7500,monthly
4126,Business Development Executive,Aircomaster Sdn Bhd,"Ampang, Cyberjaya, Petaling Jaya, Puchong, Shah Alam/Subang, Subang Jaya",MYR 3.5K - 7K monthly,MYR,3500,7000,monthly
4128,Software Engineer (Based in Puchong),Store & Send Logistics Sdn Bhd,Puchong,MYR 5K - 9K monthly,MYR,5000,9000,monthly
4142,Contract Executive,China Construction Engineering (S.E.A) Malaysia Sdn. Bhd.,"Kuala Lumpur, Bentong",MYR 2.4K - 3.2K monthly,MYR,2400,3200,monthly
4145,Admin Executive (Fresh Grad Welcome | Global Company | Near LRT),TWY Search International (M) Sdn Bhd,Petaling Jaya,MYR 2.5K - 3K monthly,MYR,2500,3000,monthly
4146,"Receptionist & Front-Desk at Jalan Raja Laut, RM2,000 !!",Agensi Pekerjaan Adecco Personnel Sdn Bhd,Kuala Lumpur,MYR 1.8K - 2K monthly,MYR,1800,2000,monthly
4149,Sales & Marketing Executive (Wood base door product  @ Kuchai Lama),AGENSI PEKERJAAN DREAM CAREER SDN BHD,"Kuala Lumpur, Selangor",MYR 3.2K - 6K monthly,MYR,3200,6000,monthly
4150,Senior Web Developer,Price Guide Sdn Bhd,Petaling Jaya,MYR 8.5K - 12K monthly,MYR,8500,1000,monthly
4154,PHP Developer,Zeptomobile Sdn Bhd,Kuala Lumpur,MYR 3.5K - 6.5K monthly,MYR,3500,6500,monthly
4156,Sales Executive(Healthcare Industry - Antimicrobial flooring & Walling material),AGENSI PEKERJAAN DREAM CAREER SDN BHD,"Kuala Lumpur, Selangor",MYR 3.5K - 6K monthly,MYR,3500,6000,monthly
4166,Retail Fashion Associate-THE SPRING KUCHING,HLA  GARMENT (SINGAPORE) PTE. LTD.,Kuching,MYR 1.6K - 2K monthly,MYR,1600,2000,monthly
4169,Accounts Executive (Klang) - 5 Days Job,Agensi Pekerjaan SGS Sdn Bhd (JTKSM 416A),Selangor,MYR 2.2K - 4K monthly,MYR,2200,4000,monthly
4170,Quality Assurance (QA) Engineer,Octafa Consulting Sdn Bhd,Kuala Lumpur,MYR 3K - 5K monthly,MYR,3000,5000,monthly
4172,Corporate Finance Manager,OHR Marketing Sdn Bhd,Alor Setar,MYR 5K - 7K monthly,MYR,5000,7000,monthly
4173,CORPORATE SERVICES ASSISTANT,Agensi Pekerjaan Yes Boss Sdn Bhd,Kuala Lumpur,MYR 1.5K - 2.5K monthly,MYR,1500,2500,monthly
4174,BRANCH MANAGER,Premier Clinic,"Kuala Lumpur, Selangor",MYR 4K - 5.6K monthly,MYR,4000,5600,monthly
4176,Asst. Product Manager (E-Commerce),BOTATO SDN. BHD.,Puchong,MYR 2.5K - 4K monthly,MYR,2500,4000,monthly
4179,Electrical Engineer,INTCO MALAYSIA SDN. BHD.,Klang/Port Klang,MYR 3.5K - 4K monthly,MYR,3500,4000,monthly
4181,"GENERAL MANAGER, RADIFLEET SDN BHD",Radicare (M) Sdn Bhd,"Kuala Lumpur, Selangor",MYR 10K - 13K monthly,MYR,1000,1000,monthly
4183,Contracts Manager,Company Confidential,Cheras,MYR 10K - 12K monthly,MYR,1000,1000,monthly
4185,Indoor Sales Coordinator,Seng Choon Hardware (M) Sdn Bhd,Shah Alam/Subang,MYR 2.5K - 3.5K monthly,MYR,2500,3500,monthly
4186,Food Processing Technician,Seadling Sdn Bhd,Kota Kinabalu,MYR 1.5K - 2.5K monthly,MYR,1500,2500,monthly
4187,Medical Rep,Norefal (Mktg) Sdn Bhd,Petaling Jaya,MYR 3.5K - 4.9K monthly,MYR,3500,4900,monthly
4188,Customer Care Executive,SK Networks Retails Malaysia Sdn Bhd,Kuala Lumpur,MYR 2K - 3K monthly,MYR,2000,3000,monthly
4189,Financial Service Consultant – Good Basic Salary + High Commission.,SIB ARISE TEAM,"Batu Pahat, Johor Bahru",MYR 3.5K - 4.9K monthly,MYR,3500,4900,monthly
4193,PMO Manager,ZCHWANTECH SDN. BHD.,Petaling Jaya,MYR 10K - 16K monthly,MYR,1000,1000,monthly
4197,Production Manager,GE-PAP Sdn Bhd,Selangor,MYR 8K - 10K monthly,MYR,8000,1000,monthly
4199,SUPERVISOR,TRADING COMPANY,Johor - Others,MYR 1.8K - 3.6K monthly,MYR,1800,3600,monthly
4201,Nurse,Aexle Medical (M) Sdn Bhd,Kajang/Bangi/Serdang,MYR 2.2K - 3.8K monthly,MYR,2200,3800,monthly
4205,Customer Service Representative,DEFI TECH SDN. BHD.,Kuala Lumpur,MYR 2.8K - 3.3K monthly,MYR,2800,3300,monthly
4206,Financial Consultant (PEMC),VT SMART VENTURE SDN BHD,Selangor,MYR 5K - 10K monthly,MYR,5000,1000,monthly
4207,Customer Support (Hiring Immediately),Agensi Pekerjaan Asia Recruit Sdn Bhd,Kuala Lumpur,MYR 1.3K - 1.8K monthly,MYR,1300,1800,monthly
4208,MARKETING ASSISTANT,RED DRAGONFLY SDN. BHD.,Puchong,MYR 2.5K - 3.3K monthly,MYR,2500,3300,monthly
4209,BUSINESS DEVELOPMENT ASSISTANT,ONE XOX SDN BHD,Selangor,MYR 1.8K - 2.3K monthly,MYR,1800,2300,monthly
4210,Backend Engineer,Ambition Group Malaysia Sdn Bhd,Kuala Lumpur,MYR 7K - 13K monthly,MYR,7000,1000,monthly
4211,Property Agent,R&F Property Services Group,Johor,MYR 5K - 10K monthly,MYR,5000,1000,monthly
4212,Branch Manager,Agensi Pekerjaan Adecco Personnel Sdn Bhd,Selangor,MYR 7K - 10K monthly,MYR,7000,1000,monthly
4213,SALES ADMIN CLERK,ELT Solutions Sdn Bhd,Muar,MYR 1.2K - 1.7K monthly,MYR,1200,1700,monthly
4219,"Executive, Supply Chain Operations",Kelly Services (Malaysia) Sdn Bhd,Kuala Lumpur,MYR 2.5K - 3K monthly,MYR,2500,3000,monthly
4237,Administrative Officer - Global Road Safety Partnership,International Federation of Red Cross & Red Crescent Societies,Kuala Lumpur,MYR 4K - 6K monthly,MYR,4000,6000,monthly
4239,Customer Service Executive (Manufacturing),Agensi Pekerjaan & Perundingcara Bright Prospect Sdn Bhd,"Klang/Port Klang, Shah Alam/Subang",MYR 3K - 4K monthly,MYR,3000,4000,monthly
4240,Product Manager,Austar Co. Ltd.,Kuala Lumpur,MYR 6.5K - 9K monthly,MYR,6500,9000,monthly
4242,Software Quality Assurance - Senior Test Analyst,Convoy (Malaysia) Sdn. Bhd.,Kuala Lumpur,MYR 5K - 8K monthly,MYR,5000,8000,monthly
4245,Sales & Marketing Executive (Building Material industry),AGENSI PEKERJAAN DREAM CAREER SDN BHD,"Kuala Lumpur, Selangor",MYR 3K - 5.5K monthly,MYR,3000,5500,monthly
4246,Internship for Mechanical / Mechatronics Engineering Students,NOLEK SDN BHD,Penang,MYR 400 - 500 monthly,MYR,400,500,monthly
4253,Personal Assistant,GHL Systems Berhad,Kuala Lumpur,MYR 5K - 6K monthly,MYR,5000,6000,monthly
4255,Business Sales Support Executive,SRG Asia Pacific Sdn. Bhd.,Kuala Lumpur,MYR 2.6K - 3.5K monthly,MYR,2600,3500,monthly
4256,Sales / Business Management Intern,Sales Connection - Good Works Technology Sdn Bhd,Subang Jaya,MYR 700 - 1K monthly,MYR,700,1000,monthly
4257,Project Manager,Austar Co. Ltd.,Kuala Lumpur,MYR 6.5K - 9.5K monthly,MYR,6500,9500,monthly
4259,Personal Assistant,AEON Co. (M) Bhd.,Kuala Lumpur,MYR 3.5K - 6K monthly,MYR,3500,6000,monthly
4264,Depot Operator,Dindings Poultry Processing Sdn. Bhd.,Klang/Port Klang,MYR 1.5K - 2.5K monthly,MYR,1500,2500,monthly
4269,Digital Marketing Executive,COOL JUICERY SDN. BHD.,Kuala Lumpur,MYR 2.8K - 4.8K monthly,MYR,2800,4800,monthly
4270,Marketing Executive,The Big Rajah Food Caterers Sdn Bhd,Petaling Jaya,MYR 2.5K - 3K monthly,MYR,2500,3000,monthly
4275,Antenna Design Engineer [Ref: 48931] [CR],Agensi Pekerjaan Reeracoen Malaysia Sdn Bhd,Penang,MYR 5K - 10K monthly,MYR,5000,1000,monthly
4276,Customer Relations Executive (5 Bonuses Payout Yearly),AMES Group of Companies,Kuala Lumpur,MYR 2.5K - 3.1K monthly,MYR,2500,3100,monthly
4278,DevOps Engineer / Senior DevOps Engineer,SWIFT SUPPORT SERVICES MALAYSIA SDN. BHD.,Kuala Lumpur,MYR 10K - 13K monthly,MYR,1000,1000,monthly
4282,Contracts Administrator,Gabungan AQRS Berhad,Selangor,MYR 3.5K - 4.5K monthly,MYR,3500,4500,monthly
4285,Customer Service Representative - Mandarin Speaker,Startek,"Kuala Lumpur, Selangor, Putrajaya",MYR 2K - 3.8K monthly,MYR,2000,3800,monthly
4286,Site Supervisor,China Construction Engineering (S.E.A) Malaysia Sdn. Bhd.,"Johor - Others, Kuala Lumpur, Pahang",MYR 2.8K - 4K monthly,MYR,2800,4000,monthly
4287,HR/Payroll Executive,Koong Woh Tong Sdn Bhd,Kuala Lumpur,MYR 3K - 3.8K monthly,MYR,3000,3800,monthly
4301,Senior Mobile Engineer (Front-end Developer),Hitachi Digital Host Sdn. Bhd.,Selangor,MYR 5.7K - 8.2K monthly,MYR,5700,8200,monthly
4310,Real Time Analyst Manager- Contact Centre- KL -P6,Agensi Pekerjaan BGC Group (Malaysia) Sdn Bhd,Kuala Lumpur,MYR 4K - 5K monthly,MYR,4000,5000,monthly
4314,ASSISTANT SUPERVISOR,PUREWAX,Kuala Lumpur,MYR 1.7K - 2.5K monthly,MYR,1700,2500,monthly
4315,Senior Mobile Developer,LOLOL SDN. BHD.,Melaka,MYR 4K - 10K monthly,MYR,4000,1000,monthly
4316,Corporate Sales Executive,Bacteria Free Water Engineering (M) Sdn Bhd,Subang Jaya,MYR 3K - 4.2K monthly,MYR,3000,4200,monthly
4318,Accounts Receivable Analyst (Open to Fresh Graduate),Company Confidential,Subang Jaya,MYR 2.8K - 3.5K monthly,MYR,2800,3500,monthly
4320,Junior Programmer,Kintetsu World Express (Malaysia) Sdn Bhd,Petaling Jaya,MYR 3K - 4.8K monthly,MYR,3000,4800,monthly
4322,UI Designer,Pegasus Programing Sdn. Bhd.,Kuala Lumpur,MYR 4K - 6K monthly,MYR,4000,6000,monthly
4323,Executive - Accounts,PM Securities Sdn Bhd,Kuala Lumpur,MYR 2.5K - 3K monthly,MYR,2500,3000,monthly
4325,Audit Assistant,Khoo & Co (KL),Kuala Lumpur,MYR 2.4K - 3.4K monthly,MYR,2400,3400,monthly
4326,Senior Retail Associate / Retail Associate,Pandora,"Johor, Kedah, Kuala Lumpur, Kelantan, Melaka, Negeri Sembilan, Penang, Pahang, Perak, Sabah, Selangor, Sarawak, Terengganu, Putrajaya",MYR 2K - 4K monthly,MYR,2000,4000,monthly
4327,School Nurse,Epsom College Malaysia Sdn Bhd,Negeri Sembilan,MYR 3K - 3.2K monthly,MYR,3000,3200,monthly
4328,Internship for Sciences Students,Ominent Sdn.Bhd.,Selangor,MYR 1 - 500 monthly,MYR,1,500,monthly
4330,Bancassurance Associate Programme (East Coast Region) - January Intake,RHB Banking Group,Pahang,MYR 2.5K - 3K monthly,MYR,2500,3000,monthly
4333,SALES EXECUTIVE,CB Frozen Food Sdn Bhd,Selangor,MYR 2K - 4K monthly,MYR,2000,4000,monthly
4337,FASHION MERCHANDISER (CHINA MARKET),NJY APPAREL SDN BHD,Kajang/Bangi/Serdang,MYR 3.2K - 4K monthly,MYR,3200,4000,monthly
4338,ELECTRICAL PROJECT ENGINEER,ADAPTASI MASA SDN. BHD.,Kuala Lumpur,MYR 3K - 5K monthly,MYR,3000,5000,monthly
4347,Warehouse Assistant Manager,Company Confidential,Johor,MYR 4K - 6K monthly,MYR,4000,6000,monthly
4348,Bancassurance Associate Programme (Northern Region) - January Intake,RHB Banking Group,"Kedah, Penang",MYR 2.5K - 3K monthly,MYR,2500,3000,monthly
4349,Bancassurance Associate Programme (Southern Region) - January Intake,RHB Banking Group,Johor,MYR 2.5K - 3K monthly,MYR,2500,3000,monthly
4352,Business Development Executive,LiveExpress Sdn Bhd,Kuala Lumpur,MYR 2.5K - 3.5K monthly,MYR,2500,3500,monthly
4353,Telemarketing Officer (Telco Product) TTDI Damansara Intake 5 Jan 2021,Kelly Services (Malaysia) Sdn Bhd,Kuala Lumpur,MYR 1.5K - 1.9K monthly,MYR,1500,1900,monthly
4355,Field Sales Executive (SME - Telco),Agensi Pekerjaan Asia Recruit Sdn Bhd,Selangor,MYR 2.3K - 2.6K monthly,MYR,2300,2600,monthly
4357,Project Engineer,Company Confidential,"Ampang, Shah Alam/Subang",MYR 2.5K - 4K monthly,MYR,2500,4000,monthly
4361,Sales & Marketing Manager (Based in KL),CONTINENTAL HOPE MALAYSIA INDUSTRIAL DEVELOPMENT SDN. BHD.,Kuala Lumpur,MYR 4K - 6K monthly,MYR,4000,6000,monthly
4362,Internship for Accounting Students,CryoCord Sdn Bhd,Selangor,MYR 500 - 500 monthly,MYR,500,500,monthly
4365,BAKER CHEF,Season Confectionary and Bakery,Johor Bahru,MYR 4K - 6K monthly,MYR,4000,6000,monthly
4367,SECONDARY (IGCSE) TEACHER,STARS INTERNATIONAL SCHOOL,Petaling Jaya,MYR 3K - 4.2K monthly,MYR,3000,4200,monthly
4368,Program Manager,Agensi Pekerjaan Adecco Personnel Sdn Bhd,Penang,MYR 7.7K - 9.5K monthly,MYR,7700,9500,monthly
4369,Senior Operation Executive,Hytech Consulting Management Sdn Bhd,Kuala Lumpur,MYR 3.5K - 4.5K monthly,MYR,3500,4500,monthly
4370,"Medical Representative, Pharmaceutical (Penang)",DKSH Malaysia Sdn Bhd,Ayer Itam,MYR 2.5K - 5K monthly,MYR,2500,5000,monthly
4374,Software Development Manager,MVP SMARTLIFE SDN. BHD.,Kuching,MYR 6K - 10K monthly,MYR,6000,1000,monthly
4375,Content Writer/ Copywriter,EHATI INTERNATIONAL SDN. BHD.,Selangor,MYR 1.5K - 3K monthly,MYR,1500,3000,monthly
4379,Aesthetic and Beauty Manager,LACO MALAYSIA DERMALOGY SDN. BHD.,Puchong,MYR 5K - 8K monthly,MYR,5000,8000,monthly
4380,Business Development Executive,SRG Asia Pacific Sdn. Bhd.,Kuala Lumpur,MYR 2.6K - 3.5K monthly,MYR,2600,3500,monthly
4388,Sales Executive,Genexis Health Enterprise,Johor Bahru,MYR 5K - 10K monthly,MYR,5000,1000,monthly
4390,Account Manager,MicroEngine Technology Sdn Bhd,Petaling Jaya,MYR 4K - 6K monthly,MYR,4000,6000,monthly
4391,Accounts Assistant,Kaisar Maxim Sdn Bhd,Kuala Lumpur,MYR 1.5K - 2.2K monthly,MYR,1500,2200,monthly
4392,Area Sales Manager,Austar Co. Ltd.,Kuala Lumpur,MYR 8K - 12K monthly,MYR,8000,1000,monthly
4397,Sales Executive,SHENVIRO HALL SDN BHD,Rawang,MYR 2K - 3K monthly,MYR,2000,3000,monthly
4408,Sales Executive,TEMPO SCAN PACIFIC MALAYSIA SDN. BHD.,Johor Bahru,MYR 2.8K - 4K monthly,MYR,2800,4000,monthly
4414,Personal Banker Wealth @ East Coast Region (Raub & Bentong),RHB Banking Group,Pahang,MYR 2.5K - 5K monthly,MYR,2500,5000,monthly
4416,Channel Sales & Marketing Manager,Kit Loong Commercial Tyre Sdn Bhd,Shah Alam/Subang,MYR 5K - 8K monthly,MYR,5000,8000,monthly
4420,Sales Management Trainee (Penang),Omniraise Sdn Bhd,Penang,MYR 2.8K - 3.9K monthly,MYR,2800,3900,monthly
4423,Digital Marketing Intern,Pluto Communications Sdn Bhd,Petaling Jaya,MYR 600 - 800 monthly,MYR,600,800,monthly
4425,Sales Admin Executive,LB Aluminium Berhad,Semenyih,MYR 2.3K - 3.5K monthly,MYR,2300,3500,monthly
4429,Automation Manager,Agensi Pekerjaan Adecco Personnel Sdn Bhd,Johor,MYR 11K - 12K monthly,MYR,1000,1000,monthly
4430,Account / Admin Assistant,Rivertree Resources Sdn Bhd,Kuala Lumpur,MYR 1.3K - 2.5K monthly,MYR,1300,2500,monthly
4433,Recruitment Consultant (Based in KL; Basic + Attractive Incentives),Capita Global Sdn Bhd,Kuala Lumpur,MYR 2.5K - 3.5K monthly,MYR,2500,3500,monthly
4434,Elite Financial Consultant,AIA Public Takaful Bhd - Sinergi Dinamik Associate,"Johor, Melaka, Negeri Sembilan, Kuala Lumpur, Selangor, Terengganu",MYR 3K - 9K monthly,MYR,3000,9000,monthly
4435,Telemarketing Sales Executive（Fresh Graduated Welcome）,MILLION DOLLAR GROUP CONSULTANCY,Puchong,MYR 1.5K - 3K monthly,MYR,1500,3000,monthly
4437,Category Manager (Home & Living),WOWSHOP SDN BHD,Kuala Lumpur,MYR 6K - 8.4K monthly,MYR,6000,8400,monthly
4438,Senior Software Engineers,Ambition Group Malaysia Sdn Bhd,Kuala Lumpur,MYR 7K - 10K monthly,MYR,7000,1000,monthly
4439,Technical Support Engineer,Jie Business Sdn Bhd (Formerly known as Oppo Electronics Sdn Bhd),"Shah Alam/Subang, Petaling Jaya",MYR 2.2K - 2.8K monthly,MYR,2200,2800,monthly
4440,Graphic Designer cum Marketing 平面设计师兼市场营销,Astrajaya Enterprise,Kedah - Others,MYR 2K - 2.5K monthly,MYR,2000,2500,monthly
4441,Bancassurance Associate Programme (Perak Region) - January Intake,RHB Banking Group,Perak,MYR 2.5K - 3K monthly,MYR,2500,3000,monthly
4443,"Sales Consultant/ Assistant Sales Manager, PF (Ampang Point Sales Hub)",RHB Banking Group,Kuala Lumpur,MYR 1.8K - 3.5K monthly,MYR,1800,3500,monthly
4444,International Trading Business Administrator 国际贸易业务跟单员,Wonder UV Purification (M) SDN. BHD.,Johor Bahru,MYR 2.5K - 3.5K monthly,MYR,2500,3500,monthly
4445,Finance Executive(AP),Agensi Pekerjaan Chrisjac Sdn Bhd,Kajang/Bangi/Serdang,MYR 3.5K - 4.5K monthly,MYR,3500,4500,monthly
4446,Business Development Intern,Pluto Communications Sdn Bhd,Petaling Jaya,MYR 500 - 700 monthly,MYR,500,700,monthly
4447,Technical Support,LKSOFT SOLUTIONS (M) SDN. BHD.,Johor,MYR 1.8K - 3.5K monthly,MYR,1800,3500,monthly
4449,Web Designer,Easy Asia Technologies Sdn Bhd,Petaling Jaya,MYR 2.5K - 4.5K monthly,MYR,2500,4500,monthly
4450,Property Advisor 【超高收入 • 无需经验】从零开始教你地产创业,DIGNITY CREATOR LEGACY,Kuala Lumpur,MYR 5K - 10K monthly,MYR,5000,1000,monthly
4452,Sale Manager,Insurance Company,Johor Bahru,MYR 8K - 10K monthly,MYR,8000,1000,monthly
4457,Senior Buyer - Retail Industry,WOWSHOP SDN BHD,Kuala Lumpur,MYR 5K - 8.5K monthly,MYR,5000,8500,monthly
4458,Senior Buyer / Supply Chain Executive,SIHI Pumps (Malaysia) Sdn Bhd,Kajang/Bangi/Serdang,MYR 5K - 6.4K monthly,MYR,5000,6400,monthly
4459,Strategy Manager,FOREFRONT,Petaling Jaya,MYR 4.8K - 6K monthly,MYR,4800,6000,monthly
4462,Mandarin Subject Teacher,MELODY KINDYLAND,Penang,MYR 1.8K - 2.4K monthly,MYR,1800,2400,monthly
4463,UI UX Front End Developer (Based in Puchong),Store & Send Logistics Sdn Bhd,Puchong,MYR 5K - 7K monthly,MYR,5000,7000,monthly
4466,"Sales Executive (High Basic, Commission & Incentives)",Big Lighting Company,Petaling Jaya,MYR 3.3K - 4.7K monthly,MYR,3300,4700,monthly
4467,Site Supervisor,Modular Scale Sdn Bhd,"Kuala Lumpur, Selangor",MYR 2.5K - 3.5K monthly,MYR,2500,3500,monthly
4469,Customer Service Representative (Rotational shift in between 4pm- 4am),EPS Malaysia,Kuala Lumpur,MYR 3K - 3.5K monthly,MYR,3000,3500,monthly
4471,Sales Officer,Sea Master Food Sdn Bhd,Selangor,MYR 1.8K - 2.2K monthly,MYR,1800,2200,monthly
4472,Japanese Food Chef,THREE BOSSES SDN. BHD.,Johor Bahru,MYR 2K - 4K monthly,MYR,2000,4000,monthly
4473,Planner,M.A.C Technology (M) Sdn. Bhd.,Seremban,MYR 2.5K - 3.2K monthly,MYR,2500,3200,monthly
4484,Site Safety Supervisor,China Construction Engineering (S.E.A) Malaysia Sdn. Bhd.,"Johor - Others, Kuala Lumpur, Bentong",MYR 2.4K - 3.2K monthly,MYR,2400,3200,monthly
4486,CNC Programmer,AGENSI PEKERJAAN LHC SDN. BHD.,Johor,MYR 4K - 5K monthly,MYR,4000,5000,monthly
4488,Senior SAP ABAP Solution Consultant,CBS Corporate Business Solutions Malaysia Sdn Bhd,Kuala Lumpur,MYR 9K - 15K monthly,MYR,9000,1000,monthly
4489,"Sales Representative/ Sales Executive (Kota Bharu, Kelantan)",Daikin Malaysia Sales & Service Sdn. Bhd.,Kelantan,MYR 2.5K - 4K monthly,MYR,2500,4000,monthly
4490,Technical Assistant,Southern PC Steel Sdn Bhd,Selangor,MYR 1.5K - 1.8K monthly,MYR,1500,1800,monthly
4493,SUPPLY CHAIN MANAGER - AUTOMOTIVE (REF: ST),JAC Recruitment Malaysia,"Kuala Lumpur, Negeri Sembilan, Selangor",MYR 8K - 11K monthly,MYR,8000,1000,monthly
4499,Retail Outlet Assistant,Company Confidential,Petaling Jaya,MYR 1.2K - 1.8K monthly,MYR,1200,1800,monthly
4500,Back Office Operator,DEFI TECH SDN. BHD.,Kuala Lumpur,MYR 3.5K - 4.5K monthly,MYR,3500,4500,monthly
4502,Marketing cum Admin Executive,Kompleks Mutiara Management Corporation,Kuala Lumpur,MYR 2.8K - 3.5K monthly,MYR,2800,3500,monthly
4504,Marketing Executive,Orbix Education Sdn Bhd,Kuala Lumpur,MYR 3.8K - 5.3K monthly,MYR,3800,5300,monthly
4511,Purchasing Executive,Gabungan AQRS Berhad,Selangor,MYR 2.5K - 3.5K monthly,MYR,2500,3500,monthly
4513,SOFTWARE ENGINEER,Yamaha Electronics Manufacturing (M) Sdn Bhd,Ipoh,MYR 2K - 3K monthly,MYR,2000,3000,monthly
4518,Boutique Manager / Assistant Boutique Manager,Pandora,"Johor, Kedah, Kuala Lumpur, Kelantan, Melaka, Negeri Sembilan, Penang, Pahang, Perak, Sabah, Selangor, Sarawak, Terengganu, Putrajaya",MYR 4K - 8K monthly,MYR,4000,8000,monthly
4520,Assistant Finance Manager,MHL Industries (Malaysia) Sdn Bhd,Johor Bahru,MYR 5K - 8.5K monthly,MYR,5000,8500,monthly
4521,Data Analyst 数据分析人员,J&T EXPRESS (MALAYSIA) SDN. BHD.,Kuala Lumpur,MYR 2.5K - 5K monthly,MYR,2500,5000,monthly
4528,GRAPHIC DESIGNER,LELE WORLD EMPIRE ENTERPRISE,"Johor, Kuala Lumpur, Kelantan, Melaka, Pahang, Perak, Selangor, Kuala Terengganu",MYR 1.8K - 2K monthly,MYR,1800,2000,monthly
4529,Junior DevOps Engineer,FPLE SDN.BHD.,Kuala Lumpur,MYR 3K - 4.5K monthly,MYR,3000,4500,monthly
4530,Property Sales Executive,VSG Sdn Bhd,"Kuala Pilah, Nilai, Port Dickson, Seremban",MYR 3.5K - 4.9K monthly,MYR,3500,4900,monthly
4532,Product Owner,THE NEXT SIX SDN. BHD.,Kuala Lumpur,MYR 3K - 6K monthly,MYR,3000,6000,monthly
4533,Financial Controller,Hume Concrete Sdn Bhd,Petaling Jaya,MYR 20K - 22K monthly,MYR,2000,2000,monthly
